{
  "task_id": "task-extraction-001",
  "result_summary": "Created a structured architecture summary and a draft semantic note.",
  "produced_artifacts": [
    {
      "artifact_id": "note-architecture-summary-001",
      "artifact_type": "semantic-note",
      "artifact_role": "semantic",
      "ref": "knowledge/obsidian/notes/architecture-summary.md"
    }
  ],
  "unresolved_issues": [
    "Admission to KB still requires review"
  ],
  "confidence": "medium",
  "evidence": [
    {
      "type": "document",
      "ref": "docs/source-bundle.md",
      "description": "Primary extraction input"
    }
  ],
  "suggested_placement": "obsidian",
  "suggested_followups": [
    "Run review decision on semantic note"
  ],
  "warnings": [
    "This output is not yet a sanctioned KB asset"
  ]
}
